{
  "$schema": "http://json-schema.org/draft-04/schema#",
  "type": "object",
  "properties": {
    "id": {
      "type": "integer"
    },
    "name": {
      "type": "string"
    },
    "isActive": {
      "type": "boolean"
    },
    "picture": {
      "type": "string"
    },
    "age": {
      "type": "integer"
    },
    "gender": {
      "type": "string"
    },
    "company": {
      "type": "string"
    },
    "email": {
      "type": "string"
    },
    "phone": {
      "type": "string"
    },
    "address": {
      "type": "string"
    }
  },
  "required": [
    "id",
    "name",
    "isActive",
    "picture",
    "age",
    "gender",
    "company",
    "email",
    "phone",
    "address"
  ]
}